<?xml version="1.0" encoding="UTF-8"?>
<message xmlns:xsi="http://www.w3.org/2001/XMLSchema-instance"
    version="1.0" transcode="209813" xsi:noNamespaceSchemaLocation="message.xsd" desc="积分查询(209813)">
    <request class="com.dream.messaging.connector.TIA209813">
        <property name="tia" reference="TIA_V1.0" />
        <property name="chanelFlag" class="string" length="1" status="M" default="C" /><!-- 渠道标记   X(1)    0=柜面、1=电话银行、2=网银、3=ATM、4=POS、5=多媒体终端、6=手机银行、7=家易通、9=财管平台（低柜）、L=第三方系统、Z=客服整合平台、W=IVR、V=卡中心兑换系统、S=卡中心收费系统、P=策略收单系统 -->
        <property name="idType" class="string" length="1" status="M" default="0" /><!-- 证件类型    X(1)    0-贷记卡号，1-清算账号ID -->
        <property name="id" class="string" length="28" status="M" /><!-- 证件号 X(28)   左对齐、右补空格 -->
        <property name="currencyType" class="string" length="3" /><!-- 币种  X(3)    CNY/USD；当证件类型为0时，若该字段为空则查询人民币和美元的积分余额     -->
    </request>
    <response class="com.dream.messaging.connector.TOA209813">
        <property name="toa" reference="TOA_V1.0" />
        <section precondition="outPutMessageType=N" repeated="false">
            <property name="totalMessageLength" class="int" length="4" status="M" /> <!-- 输出数据实际总长度   9(4)    整个数据区长度，包括本字段4字节在内 -->
            <property name="formatCode" class="string" length="5" status="M" /><!-- 五位格式码   X(5)    20H81 -->
            <property name="scoreBalanceCNY" class="int" length="8" status="M" /><!-- 积分余额(人民币)   9(8)    -->
            <property name="scoreBalanceUSD" class="int" length="8" status="M" /><!-- 积分余额(美元)    9(8)     -->
        </section>
         <section precondition="outPutMessageType=E" repeated="false">
            <property name="totalMessageLength" class="int" length="4" status="M" /><!-- 输出数据实际总长度   9(4)    整个数据区长度，包括本字段4字节在内 -->
            <property name="formatCode" class="string" length="5" status="M" /><!-- 五位格式码   X(5)    SCD04 -->
            <property name="errorAppCode" class="string" length="2" status="M" /><!-- 错误码所属应用符    X(2)     -->
            <property name="errorCode" class="int" length="4" status="M" /><!-- 错误信息码   9(4)     -->
            <property name="cursPos" class="int" length="4" status="M" /><!-- CURS-POS    9(4)    0001 -->
            <property name="errorMessage" class="string" length="56" /><!-- 错误信息    X(56)    -->
        </section>
    </response>
</message>